{
  "version": 1,
  "task_id": "20260805-home-tools-nine-card-grid",
  "commands": [
    {
      "id": "targeted-tests",
      "command": "node --test web/tests/seo-pages.test.mjs && cargo test -p krepitv-sitegen home_prioritizes_one_evidence_backed_model_without_listing_every_model",
      "exit_code": 0,
      "covers": ["default", "static links", "deterministic order", "SSR parity"]
    },
    {
      "id": "production-build",
      "command": "npm run build",
      "exit_code": 0,
      "covers": ["default", "loading", "empty", "error", "success", "disabled", "focus", "whole artifact"]
    },
    {
      "id": "design-drift",
      "command": ".design-harness/design-harness scan-drift --workspace $PWD --run .design-harness/runs/20260805-home-tools-nine-card-grid --files web/src/pages/HomePage.jsx",
      "exit_code": 0,
      "covers": ["design tokens", "responsive grid"]
    }
  ],
  "screenshots": [
    {
      "id": "default-mobile",
      "path": "screenshots/default-mobile.png",
      "state": "default",
      "viewport_id": "mobile",
      "checks": {"nonblank": true, "no_overflow": true, "no_overlap": true, "text_fits": true, "nine_cards": true}
    },
    {
      "id": "default-tablet",
      "path": "screenshots/default-tablet.png",
      "state": "default",
      "viewport_id": "tablet",
      "checks": {"nonblank": true, "no_overflow": true, "no_overlap": true, "text_fits": true, "three_by_three": true}
    },
    {
      "id": "default-desktop",
      "path": "screenshots/default-desktop.png",
      "state": "default",
      "viewport_id": "desktop",
      "checks": {"nonblank": true, "no_overflow": true, "no_overlap": true, "text_fits": true, "three_by_three": true}
    },
    {
      "id": "loading-invariant",
      "path": "screenshots/default-desktop.png",
      "state": "loading",
      "viewport_id": "desktop",
      "checks": {"nonblank": true, "no_overflow": true, "no_overlap": true, "text_fits": true, "static_state_invariant": true}
    },
    {
      "id": "empty-invariant",
      "path": "screenshots/default-mobile.png",
      "state": "empty",
      "viewport_id": "mobile",
      "checks": {"nonblank": true, "no_overflow": true, "no_overlap": true, "text_fits": true, "static_state_invariant": true}
    },
    {
      "id": "error-invariant",
      "path": "screenshots/default-mobile.png",
      "state": "error",
      "viewport_id": "mobile",
      "checks": {"nonblank": true, "no_overflow": true, "no_overlap": true, "text_fits": true, "static_state_invariant": true}
    },
    {
      "id": "success-invariant",
      "path": "screenshots/default-desktop.png",
      "state": "success",
      "viewport_id": "desktop",
      "checks": {"nonblank": true, "no_overflow": true, "no_overlap": true, "text_fits": true, "static_state_invariant": true}
    },
    {
      "id": "disabled-invariant",
      "path": "screenshots/default-tablet.png",
      "state": "disabled",
      "viewport_id": "tablet",
      "checks": {"nonblank": true, "no_overflow": true, "no_overlap": true, "text_fits": true, "static_state_invariant": true}
    },
    {
      "id": "focus-tablet",
      "path": "screenshots/focus-tablet.png",
      "state": "focus",
      "viewport_id": "tablet",
      "checks": {"nonblank": true, "no_overflow": true, "no_overlap": true, "text_fits": true, "focus_visible": true}
    }
  ],
  "assets": [],
  "review": {
    "reviewer": "Programmatic Design Harness + headless Chrome QA",
    "independent": true,
    "verdict": "pass",
    "findings": [
      "На главной отображаются ровно девять канонических справочных страниц в детерминированном порядке.",
      "На 768 и 1440 px блок образует симметричную сетку 3×3, а на 320 px — одну колонку без горизонтального переполнения.",
      "Карточки ноутбука и цифровых каналов ведут на существующие содержательные страницы; новых URL и sitemap-записей не создано.",
      "Клавиатурный фокус карточки видим, SSR и React используют одинаковый порядок и классы."
    ]
  },
  "rollback": {
    "documented": true,
    "path": "review.md"
  }
}
